{
  "$schema": "https://json-schema.org/draft/2020-12/schema",
  "title": "LAGN v1.0 — Legendary Arena Game Notation",
  "description": "Three-tier JSON format for Legendary Arena game records: Tier 1 (setup), Tier 2 (card catalog), Tier 3 (replay log)",
  "type": "object",
  "properties": {
    "lagn_version": {
      "type": "string",
      "const": "1.0.0"
    },
    "$schema": {
      "type": "string",
      "format": "uri",
      "default": "https://legendary-arena.com/schemas/lagn/v1/lagn-v1.json"
    },
    "game_id": {
      "type": "string",
      "description": "Unique game identifier"
    },
    "variant": {
      "type": "string",
      "enum": [
        "solo",
        "cooperative",
        "competitive"
      ]
    },
    "player_count": {
      "type": "integer",
      "minimum": 1,
      "maximum": 5
    },
    "setup": {
      "type": "object",
      "required": [
        "mastermind",
        "scheme",
        "villain_groups",
        "henchmen_groups",
        "heroes",
        "bystanders_count",
        "wounds_count",
        "shield_officers_count",
        "sidekicks_count"
      ],
      "properties": {
        "mastermind": {
          "type": "object",
          "required": [
            "id",
            "name"
          ],
          "properties": {
            "id": {
              "type": "string"
            },
            "name": {
              "type": "string"
            }
          }
        },
        "scheme": {
          "type": "object",
          "required": [
            "id",
            "name"
          ],
          "properties": {
            "id": {
              "type": "string"
            },
            "name": {
              "type": "string"
            }
          }
        },
        "villain_groups": {
          "type": "array",
          "minItems": 1,
          "items": {
            "type": "object",
            "required": [
              "id",
              "name"
            ],
            "properties": {
              "id": {
                "type": "string"
              },
              "name": {
                "type": "string"
              }
            }
          }
        },
        "henchmen_groups": {
          "type": "array",
          "minItems": 1,
          "items": {
            "type": "object",
            "required": [
              "id",
              "name"
            ],
            "properties": {
              "id": {
                "type": "string"
              },
              "name": {
                "type": "string"
              }
            }
          }
        },
        "heroes": {
          "type": "array",
          "minItems": 1,
          "items": {
            "type": "object",
            "required": [
              "id",
              "name"
            ],
            "properties": {
              "id": {
                "type": "string"
              },
              "name": {
                "type": "string"
              }
            }
          }
        },
        "bystanders_count": {
          "type": "integer",
          "minimum": 0
        },
        "wounds_count": {
          "type": "integer",
          "minimum": 0
        },
        "shield_officers_count": {
          "type": "integer",
          "minimum": 0
        },
        "sidekicks_count": {
          "type": "integer",
          "minimum": 0
        }
      }
    },
    "card_catalog": {
      "type": "object",
      "properties": {
        "cards": {
          "type": "array",
          "minItems": 1,
          "items": {
            "type": "object"
          }
        }
      }
    },
    "replay": {
      "type": "object",
      "properties": {
        "turns": {
          "type": "array",
          "items": {
            "type": "object"
          }
        }
      }
    },
    "result": {
      "type": "object",
      "properties": {
        "outcome": {
          "type": "string",
          "enum": [
            "victory",
            "defeat"
          ]
        },
        "loss_condition": {
          "type": "string",
          "enum": [
            "mastermind_defeated",
            "city_overrun",
            "deck_exhausted"
          ]
        },
        "victory_points": {
          "type": "integer"
        },
        "timestamp": {
          "type": "string",
          "format": "date-time"
        }
      }
    }
  },
  "required": [
    "lagn_version",
    "game_id",
    "variant",
    "player_count",
    "setup"
  ]
}