{
  "lagn_version": "1.0.0",
  "$schema": "https://legendary-arena.com/schemas/lagn/v1/lagn-v1.json",
  "game_id": "example-tier3-001",
  "variant": "cooperative",
  "player_count": 2,
  "setup": {
    "mastermind": {
      "id": "thanos",
      "name": "Thanos"
    },
    "scheme": {
      "id": "infinity-gems",
      "name": "The Infinity Gems Scheme"
    },
    "villain_groups": [
      {
        "id": "black-order",
        "name": "The Black Order"
      }
    ],
    "henchmen_groups": [
      {
        "id": "aliens",
        "name": "Alien Drones"
      }
    ],
    "heroes": [
      {
        "id": "iron-man",
        "name": "Iron Man"
      },
      {
        "id": "captain-america",
        "name": "Captain America"
      }
    ],
    "bystanders_count": 10,
    "wounds_count": 5,
    "shield_officers_count": 2,
    "sidekicks_count": 3
  },
  "card_catalog": {
    "cards": [
      {
        "card_type": "mastermind",
        "ext_id": "thanos-thanos-mm",
        "name": "Thanos",
        "image_url": "https://images.legendary-arena.com/thanos-mm.jpg"
      },
      {
        "card_type": "scheme",
        "ext_id": "infinity-gems-scheme",
        "name": "The Infinity Gems",
        "image_url": "https://images.legendary-arena.com/infinity-gems.jpg"
      },
      {
        "card_type": "villain_group",
        "ext_id": "black-order-vg",
        "name": "The Black Order",
        "image_url": "https://images.legendary-arena.com/black-order.jpg"
      },
      {
        "card_type": "henchmen_group",
        "ext_id": "alien-drones-hm",
        "name": "Alien Drones",
        "rarity_code": "c1",
        "image_url": "https://images.legendary-arena.com/alien-drones.jpg"
      },
      {
        "card_type": "hero",
        "ext_id": "iron-man-hero",
        "name": "Iron Man",
        "hero_class": ["tech", "ranged"],
        "rarity_code": "ra",
        "image_url": "https://images.legendary-arena.com/iron-man.jpg"
      },
      {
        "card_type": "hero",
        "ext_id": "captain-america-hero",
        "name": "Captain America",
        "hero_class": ["strength"],
        "rarity_code": "ra",
        "image_url": "https://images.legendary-arena.com/captain-america.jpg"
      }
    ]
  },
  "replay": {
    "turns": [
      {
        "turn_number": 1,
        "active_player_id": "player-1",
        "villain_events": [
          {
            "phase": "patrol",
            "card_ext_id": "black-order-vg"
          }
        ],
        "player_actions": [
          {
            "seq": 0,
            "action_type": "hero_play",
            "actor_player_id": "player-1",
            "target_card_ext_id": "iron-man-hero"
          },
          {
            "seq": 1,
            "action_type": "hero_recruit",
            "actor_player_id": "player-1"
          },
          {
            "seq": 2,
            "action_type": "villain_attack",
            "actor_player_id": "system"
          }
        ]
      },
      {
        "turn_number": 2,
        "active_player_id": "player-2",
        "villain_events": [
          {
            "phase": "ambush",
            "card_ext_id": "alien-drones-hm"
          }
        ],
        "player_actions": [
          {
            "seq": 0,
            "action_type": "hero_play",
            "actor_player_id": "player-2",
            "target_card_ext_id": "captain-america-hero"
          },
          {
            "seq": 1,
            "action_type": "bystander_capture",
            "actor_player_id": "system"
          }
        ]
      }
    ]
  },
  "result": {
    "outcome": "victory",
    "victory_points": 42,
    "timestamp": "2026-06-12T15:30:00Z"
  }
}
