{
  "lagn_version": "1.0.0",
  "$schema": "https://legendary-arena.com/schemas/lagn/v1/lagn-v1.json",
  "game_id": "example-tier2-001",
  "variant": "cooperative",
  "player_count": 2,
  "setup": {
    "mastermind": {
      "id": "thanos",
      "name": "Thanos"
    },
    "scheme": {
      "id": "infinity-gems",
      "name": "The Infinity Gems Scheme"
    },
    "villain_groups": [
      {
        "id": "black-order",
        "name": "The Black Order"
      }
    ],
    "henchmen_groups": [
      {
        "id": "aliens",
        "name": "Alien Drones"
      }
    ],
    "heroes": [
      {
        "id": "iron-man",
        "name": "Iron Man"
      },
      {
        "id": "captain-america",
        "name": "Captain America"
      }
    ],
    "bystanders_count": 10,
    "wounds_count": 5,
    "shield_officers_count": 2,
    "sidekicks_count": 3
  },
  "card_catalog": {
    "cards": [
      {
        "card_type": "mastermind",
        "ext_id": "thanos-thanos-mm",
        "name": "Thanos",
        "image_url": "https://images.legendary-arena.com/thanos-mm.jpg"
      },
      {
        "card_type": "scheme",
        "ext_id": "infinity-gems-scheme",
        "name": "The Infinity Gems",
        "image_url": "https://images.legendary-arena.com/infinity-gems.jpg"
      },
      {
        "card_type": "villain_group",
        "ext_id": "black-order-vg",
        "name": "The Black Order",
        "image_url": "https://images.legendary-arena.com/black-order.jpg"
      },
      {
        "card_type": "henchmen_group",
        "ext_id": "alien-drones-hm",
        "name": "Alien Drones",
        "rarity_code": "c1",
        "image_url": "https://images.legendary-arena.com/alien-drones.jpg"
      },
      {
        "card_type": "hero",
        "ext_id": "iron-man-hero",
        "name": "Iron Man",
        "hero_class": ["tech", "ranged"],
        "rarity_code": "ra",
        "image_url": "https://images.legendary-arena.com/iron-man.jpg"
      },
      {
        "card_type": "hero",
        "ext_id": "captain-america-hero",
        "name": "Captain America",
        "hero_class": ["strength"],
        "rarity_code": "ra",
        "image_url": "https://images.legendary-arena.com/captain-america.jpg"
      },
      {
        "card_type": "shield_officer",
        "ext_id": "shield-officer-1",
        "name": "S.H.I.E.L.D. Officer",
        "image_url": "https://images.legendary-arena.com/shield-officer.jpg"
      },
      {
        "card_type": "sidekick",
        "ext_id": "sidekick-1",
        "name": "Sidekick",
        "image_url": "https://images.legendary-arena.com/sidekick.jpg"
      }
    ]
  }
}
